{"failed_reviewers":["opencode"],"groups":[{"agreeing_critics":[],"all_anchors":[{"context_hash":"1111111111111111111111111111111111111111111111111111111111111111","end":{"line_code":null,"new_line":10,"old_line":null},"hunk_header":"@@ -1,1 +1,2 @@","new_path":"src/foo.py","old_path":"src/foo.py","side":"new","start":{"line_code":null,"new_line":10,"old_line":null},"symbol":null},{"context_hash":"2222222222222222222222222222222222222222222222222222222222222222","end":{"line_code":null,"new_line":10,"old_line":null},"hunk_header":"@@ -1,1 +1,2 @@","new_path":"src/foo.py","old_path":"src/foo.py","side":"new","start":{"line_code":null,"new_line":10,"old_line":null},"symbol":null}],"body":"The config lookup raises KeyError for missing required values.","body_hash":"0000000000000000000000000000000000000000000000000000000000000000","candidate_issue_signature_hashes":["10a29e90c21276e4b6f4813cc61b82dbb815b1410361f240f539464d9ac0a727","752957861d54130837a139821dc18d81f925cbb09f80eb2a9c53f8467b3b14e3"],"category":"correctness","contributing_reviewers":["claude","codex"],"critique_disputes":[],"critique_summary":{"agree":0,"dispute":0,"duplicate":0,"noise":0},"decision":"surface","evidence_by_reviewer":{"claude":"config['required']","codex":"config['required']"},"final_severity":"major","issue_id":"015c034c021aa77d703f3e9766537fc60f9ec42108cc5bdadba632bdffa27604","issue_id_source":"new_signature","match_keys":{"category":"correctness","context_hashes":["1111111111111111111111111111111111111111111111111111111111111111","2222222222222222222222222222222222222222222222222222222222222222"],"path_keys":["src/foo.py"],"symbols":[],"title_fingerprints":["aaaaaaaaaaaaaaaaaaaaaaaaaaaaaaaaaaaaaaaaaaaaaaaaaaaaaaaaaaaaaaaa"]},"representative_anchor":{"context_hash":"1111111111111111111111111111111111111111111111111111111111111111","end":{"line_code":null,"new_line":10,"old_line":null},"hunk_header":"@@ -1,1 +1,2 @@","new_path":"src/foo.py","old_path":"src/foo.py","side":"new","start":{"line_code":null,"new_line":10,"old_line":null},"symbol":null},"source_finding_ids":["1111111111111111111111111111111111111111111111111111111111111111","2222222222222222222222222222222222222222222222222222222222222222"],"state_match":{"matched_issue_id":null,"precedence":null,"status":"new"},"suggestion":null,"support_count":2,"title":"Config lookup crashes"}],"head_sha":"hhhhhhhhhhhhhhhhhhhhhhhhhhhhhhhhhhhhhhhh","input_manifest_sha256":"cef83bdf0649398831ce952ed533957eebb441b5db5248ea52e6b04b1ff44ba8","merge_request_iid":"2","panel_status":"degraded","project_id":"1","resolution_eligible_reviewers":["claude","codex"],"run_health":{"grade":"degraded","jobs":[{"accepted_finding_count":1,"cap_omitted_finding_count":1,"critique_count":null,"dropped_finding_count":1,"duration_ms":724000,"effort":"medium","error_class":null,"error_message":null,"model":"model","outcome":"success","raw_finding_count":3,"reviewer":"claude","stage":"review","timeout_seconds":1800},{"accepted_finding_count":1,"cap_omitted_finding_count":0,"critique_count":null,"dropped_finding_count":0,"duration_ms":521000,"effort":null,"error_class":null,"error_message":null,"model":"model","outcome":"success","raw_finding_count":1,"reviewer":"codex","stage":"review","timeout_seconds":1800},{"accepted_finding_count":0,"cap_omitted_finding_count":0,"critique_count":null,"dropped_finding_count":0,"duration_ms":1795012,"effort":null,"error_class":"TimeoutExpired","error_message":"reviewer exceeded 1795s","model":"model","outcome":"timeout","raw_finding_count":0,"reviewer":"opencode","stage":"review","timeout_seconds":1800},{"accepted_finding_count":null,"cap_omitted_finding_count":null,"critique_count":0,"dropped_finding_count":null,"duration_ms":242000,"effort":"medium","error_class":null,"error_message":null,"model":"model","outcome":"success","raw_finding_count":null,"reviewer":"claude","stage":"critique","timeout_seconds":900},{"accepted_finding_count":null,"cap_omitted_finding_count":null,"critique_count":0,"dropped_finding_count":null,"duration_ms":370000,"effort":null,"error_class":null,"error_message":null,"model":"model","outcome":"success","raw_finding_count":null,"reviewer":"codex","stage":"critique","timeout_seconds":900},{"accepted_finding_count":null,"cap_omitted_finding_count":null,"critique_count":null,"dropped_finding_count":null,"duration_ms":null,"effort":null,"error_class":null,"error_message":null,"model":"model","outcome":"missing","raw_finding_count":null,"reviewer":"opencode","stage":"critique","timeout_seconds":900}]},"run_id":"run","schema_version":"consensus.v2","successful_reviewers":["claude","codex"],"summary":{"drop_count":0,"fyi_count":0,"surface_count":1}}
